{
  "aid": "did:aip:personal:9f3a1c82b4e6d7f0a2b5c8e1d4f7a0b3",
  "name": "Alice-Personal-Assistant",
  "type": "personal",
  "model": {
    "provider": "anthropic",
    "model_id": "claude-sonnet-4-6",
    "attestation_hash": "sha256:a1b2c3d4e5f6789012345678901234567890abcdef1234567890abcdef123456"
  },
  "created_at": "2026-03-22T10:00:00Z",
  "version": 1,
  "public_key": {
    "kty": "OKP",
    "crv": "Ed25519",
    "x": "11qYAYKxCrfVS_7TyWQHOg7hcvPapiMlrwIaaPcHURo",
    "kid": "did:aip:personal:9f3a1c82b4e6d7f0a2b5c8e1d4f7a0b3#key-1"
  },
  "fallback_public_key_x": "kjotB-sw4JsPU75wP8Z55yELpjRct4_-0mayRaf0SmY",
  "fallback_key_proof": "-2IZOtAjJOX-2rIYtyexxIXEw-5QLdhvzyoMuRO5tlL7TZI_tjgk8XRTpkeViJoHWEDGd2Av4pgwpXQAEo6xCQ"
}
